{
	"name": "KDCO",
	"namespace": "kdco",
	"version": "1.0.0",
	"author": "kdcokenny",
	"opencode": "1.1.0",
	"ocx": "1.0.16",
	"components": [
		{
			"name": "workspace-plugin",
			"type": "ocx:plugin",
			"description": "Plan management and rule injection for workspace workflows",
			"files": ["plugin/workspace-plugin.ts"],
			"dependencies": ["background-agents"]
		},
		{
			"name": "plan-protocol",
			"type": "ocx:skill",
			"description": "Guidelines for using the plan system",
			"files": ["skill/plan-protocol/SKILL.md"],
			"dependencies": ["workspace-plugin"]
		},
		{
			"name": "code-philosophy",
			"type": "ocx:skill",
			"description": "The 5 Laws of Elegant Defense",
			"files": ["skill/code-philosophy/SKILL.md"],
			"dependencies": []
		},
		{
			"name": "frontend-philosophy",
			"type": "ocx:skill",
			"description": "The 5 Pillars of Intentional UI",
			"files": ["skill/frontend-philosophy/SKILL.md"],
			"dependencies": []
		},
		{
			"name": "code-review",
			"type": "ocx:skill",
			"description": "Structured code review methodology with severity levels and categories",
			"files": ["skill/code-review/SKILL.md"],
			"dependencies": []
		},
		{
			"name": "researcher",
			"type": "ocx:agent",
			"description": "Knowledge architect for external research",
			"files": ["agent/researcher.md"],
			"dependencies": ["background-agents"],
			"opencode": {
				"mcp": {
					"context7": "https://mcp.context7.com/mcp",
					"exa": "https://mcp.exa.ai/mcp",
					"gh_grep": "https://mcp.grep.app",
					"kagi": {
						"type": "local",
						"command": ["npx", "-y", "github:czottmann/kagi-ken-mcp"],
						"environment": {
							"KAGI_SESSION_TOKEN": "{file:~/.secrets/kagi-session-token}"
						},
						"enabled": false
					}
				},
				"permission": {
					"context7_*": "deny",
					"exa_*": "deny",
					"gh_grep_*": "deny",
					"kagi_*": "deny"
				},
				"agent": {
					"researcher": {
						"permission": {
							"context7_*": "allow",
							"exa_*": "allow",
							"gh_grep_*": "allow",
							"kagi_*": "deny",
							"write": "deny",
							"edit": "deny",
							"bash": {
								"*": "deny",
								"gh repo view*": "allow",
								"gh pr view*": "allow",
								"gh pr list*": "allow",
								"gh issue view*": "allow",
								"gh issue list*": "allow",
								"gh release view*": "allow",
								"gh release list*": "allow",
								"gh run view*": "allow",
								"gh run list*": "allow",
								"gh workflow list*": "allow",
								"gh search *": "allow",
								"npm view*": "allow",
								"npm info*": "allow",
								"npm show*": "allow",
								"pip show*": "allow",
								"pip index*": "allow",
								"cargo search*": "allow",
								"cargo info*": "allow",
								"man *": "allow",
								"tldr *": "allow",
								"dig *": "allow",
								"nslookup *": "allow",
								"whois *": "allow",
								"host *": "allow"
							}
						}
					}
				}
			}
		},
		{
			"name": "scribe",
			"type": "ocx:agent",
			"description": "Human-facing content specialist",
			"files": ["agent/scribe.md"],
			"dependencies": [],
			"opencode": {
				"agent": {
					"scribe": {
						"permission": {
							"bash": { "*": "deny" },
							"edit": "allow",
							"glob": "allow",
							"read": "allow",
							"write": "allow"
						}
					}
				}
			}
		},
		{
			"name": "coder",
			"type": "ocx:agent",
			"description": "Technical implementation specialist for writing and modifying code",
			"files": ["agent/coder.md"],
			"dependencies": ["background-agents"],
			"opencode": {
				"agent": {
					"coder": {
						"permission": {
							"context7_*": "deny",
							"exa_*": "deny",
							"gh_grep_*": "deny",
							"read": "allow",
							"write": "allow",
							"edit": "allow",
							"glob": "allow",
							"grep": "allow",
							"bash": "allow"
						}
					}
				}
			}
		},
		{
			"name": "reviewer",
			"type": "ocx:agent",
			"description": "Code review specialist that analyzes code for issues and improvements",
			"files": ["agent/reviewer.md"],
			"dependencies": ["code-review"],
			"opencode": {
				"agent": {
					"reviewer": {
						"temperature": 0.1,
						"permission": {
							"edit": "deny",
							"write": "deny",
							"bash": {
								"*": "deny",
								"git diff*": "allow",
								"git log*": "allow",
								"git show*": "allow",
								"git blame*": "allow",
								"rg *": "allow"
							}
						}
					}
				}
			}
		},

		{
			"name": "background-agents",
			"type": "ocx:plugin",
			"description": "Background agent execution - run async tasks while you work",
			"files": ["plugin/background-agents.ts"],
			"dependencies": [],
			"npmDevDependencies": ["unique-names-generator@4.7.1"],
			"opencode": {
				"permission": {
					"task": "deny"
				}
			}
		},
		{
			"name": "notify",
			"type": "ocx:plugin",
			"description": "Native OS notifications - get notified when tasks complete",
			"files": ["plugin/notify.ts"],
			"dependencies": [],
			"npmDevDependencies": ["node-notifier@10.0.1", "detect-terminal@2.0.0"]
		},
		{
			"name": "review",
			"type": "ocx:command",
			"description": "Trigger code review on files or git diffs",
			"files": ["command/review.md"],
			"dependencies": ["reviewer"]
		},
		{
			"name": "workspace",
			"type": "ocx:bundle",
			"description": "Full KDCO Workspace experience",
			"files": [],
			"dependencies": [
				"workspace-plugin",
				"plan-protocol",
				"researcher",
				"scribe",
				"coder",
				"reviewer",
				"review",
				"notify"
			],
			"opencode": {
				"plugin": ["@tarquinen/opencode-dcp@1.1.2"],
				"permission": {
					"webfetch": "deny"
				},
				"agent": {
					"plan": {
						"permission": {
							"edit": "deny",
							"write": "deny",
							"bash": { "*": "deny" },
							"task": "allow"
						}
					},
					"build": {
						"prompt": "You are a **build orchestrator**. You coordinate implementation through delegation - you do NOT implement directly.\\\\n\\\\n## Your Role\\\\n- Delegate implementation to `coder`\\\\n- Delegate documentation to `scribe`\\\\n- Delegate codebase analysis to `explore`\\\\n- Delegate external research to `researcher`\\\\n- Interpret results and decide next steps\\\\n\\\\n## Critical Constraint\\\\nYou CANNOT edit files or run commands directly. For ALL implementation and verification, delegate to `coder`.",
						"permission": {
							"edit": "deny",
							"write": "deny",
							"bash": { "*": "deny" },
							"task": "allow"
						}
					},
					"explore": {
						"permission": {
							"edit": "deny",
							"write": "deny",
							"bash": {
								"*": "deny",
								"ls *": "allow",
								"tree *": "allow",
								"pwd": "allow",
								"cat *": "allow",
								"head *": "allow",
								"tail *": "allow",
								"wc *": "allow",
								"file *": "allow",
								"stat *": "allow",
								"grep *": "allow",
								"rg *": "allow",
								"find *": "allow",
								"git status*": "allow",
								"git log*": "allow",
								"git diff*": "allow",
								"git show*": "allow",
								"git blame*": "allow",
								"git branch*": "allow",
								"git ls-files*": "allow",
								"uname*": "allow",
								"hostname": "allow",
								"whoami": "allow",
								"which *": "allow",
								"realpath *": "allow"
							}
						}
					}
				}
			}
		},
		{
			"name": "philosophy",
			"type": "ocx:bundle",
			"description": "Full KDCO Philosophy enforcement",
			"files": ["philosophy/AGENTS.md"],
			"dependencies": ["code-philosophy", "frontend-philosophy"]
		}
	]
}
